{
  "schema_version": "block_dna_adapt_001/1.0",
  "request_id": "req_wall_window_001",
  "build_graph_id": "graph_wall_window_v1",
  "world_profile": "cozy_cyber_pixel",
  "expected_world_revision": 0,
  "current_world_revision": 0,
  "idempotency_key": "idem_graph_wall_window_v1",
  "bounds": {
    "min": {
      "x": -32,
      "y": -32,
      "z": 0
    },
    "max": {
      "x": 32,
      "y": 32,
      "z": 16
    }
  },
  "nodes": [
    {
      "node_id": "wall",
      "module_id": "arch_wall_window_4m",
      "transform": {
        "x": 1.0,
        "y": 1.0,
        "elevation": 0.0,
        "rotation_deg": 0.0,
        "scale": 1.0
      },
      "occupancy_cell": {
        "cx": 2,
        "cy": 2,
        "cz": 0
      },
      "material_slot": "structure",
      "p1e_material_id": "MAT_CozyStoneWarm"
    },
    {
      "node_id": "window",
      "module_id": "arch_window_frame_simple",
      "transform": {
        "x": 1.5,
        "y": 1.0,
        "elevation": 1.0,
        "rotation_deg": 0.0,
        "scale": 1.0
      },
      "occupancy_cell": {
        "cx": 3,
        "cy": 2,
        "cz": 4
      },
      "material_slot": "glass",
      "p1e_material_id": "MAT_CozyGlass"
    }
  ],
  "edges": [
    {
      "edge_id": "e_wall_window",
      "from_node": "wall",
      "from_socket": "wall_edge",
      "from_polarity": "peer",
      "to_node": "window",
      "to_socket": "window_opening",
      "to_polarity": "peer",
      "adapter_normalization_id": "norm_wall_edge_window_opening_v1"
    }
  ],
  "generators": [],
  "world_rules": [
    {
      "rule_id": "rule_day_night_v1"
    }
  ],
  "manifestation": {
    "stages": [
      "wireframe",
      "hologram",
      "materializing",
      "complete"
    ],
    "requires_confirmation": true,
    "presentation_duration_seconds": 4
  },
  "validation": {
    "collision": true,
    "occupancy": true,
    "sockets": true,
    "cycle": true,
    "snap": true
  },
  "rollback": {
    "allowed": true,
    "mode": "COMPENSATING_MUTATION"
  },
  "adapter_proposal": {
    "kind": "structured_world_prompt_proposal",
    "confirmation_state": "pending",
    "preview_required": true
  },
  "payload_fingerprint": "f8faa0dcaff89218859f33df275d1618e5b8aea6d409d44b54396a51b678bae3"
}
